<?xml version="1.0"  encoding="iso-8859-1"?>
<!DOCTYPE filter-gui SYSTEM "gui_filter.dtd">
<filter-gui name="WatershedSegmenterTreeGeneratorGui_Darby">
  <parameters>
    <param name="flood_level">
      <gui>text-entry</gui>
      <default>0.25</default>
    </param>
    <param name="merge">
      <gui>text-entry</gui>
      <default>0</default>
    </param>
  </parameters>

</filter-gui>